{
  "batch_id": "batch_20260702_030341",
  "tests": [
    {
      "id": 1860,
      "test_node": "tests/entrypoints/openai/tool_parsers/test_gigachat3_tool_parser.py::test_tool_call[complex_nonstreaming]",
      "test_file": "tests/entrypoints/openai/tool_parsers/test_gigachat3_tool_parser.py",
      "test_name": "test_tool_call[complex_nonstreaming]",
      "status": "pending",
      "priority": "P2",
      "batch_id": null,
      "last_batch_id": null,
      "run_count": 0,
      "retry_count": 0,
      "max_retry": 2,
      "last_run_at": null,
      "last_duration_ms": null,
      "last_exit_code": null,
      "error_type": null,
      "error_message": null,
      "ignored_reason": null,
      "fix_applied": false,
      "fix_details": null,
      "log_file": null,
      "errors": [],
      "failures": []
    },
    {
      "id": 1861,
      "test_node": "tests/entrypoints/openai/tool_parsers/test_gigachat3_tool_parser.py::test_streaming_tool_call_with_large_steps",
      "test_file": "tests/entrypoints/openai/tool_parsers/test_gigachat3_tool_parser.py",
      "test_name": "test_streaming_tool_call_with_large_steps",
      "status": "pending",
      "priority": "P2",
      "batch_id": null,
      "last_batch_id": null,
      "run_count": 0,
      "retry_count": 0,
      "max_retry": 2,
      "last_run_at": null,
      "last_duration_ms": null,
      "last_exit_code": null,
      "error_type": null,
      "error_message": null,
      "ignored_reason": null,
      "fix_applied": false,
      "fix_details": null,
      "log_file": null,
      "errors": [],
      "failures": []
    },
    {
      "id": 1862,
      "test_node": "tests/entrypoints/openai/tool_parsers/test_hermes_tool_parser.py::test_non_streaming_tool_call",
      "test_file": "tests/entrypoints/openai/tool_parsers/test_hermes_tool_parser.py",
      "test_name": "test_non_streaming_tool_call",
      "status": "pending",
      "priority": "P2",
      "batch_id": null,
      "last_batch_id": null,
      "run_count": 0,
      "retry_count": 0,
      "max_retry": 2,
      "last_run_at": null,
      "last_duration_ms": null,
      "last_exit_code": null,
      "error_type": null,
      "error_message": null,
      "ignored_reason": null,
      "fix_applied": false,
      "fix_details": null,
      "log_file": null,
      "errors": [],
      "failures": []
    },
    {
      "id": 1863,
      "test_node": "tests/entrypoints/openai/tool_parsers/test_hermes_tool_parser.py::test_streaming_tool_call",
      "test_file": "tests/entrypoints/openai/tool_parsers/test_hermes_tool_parser.py",
      "test_name": "test_streaming_tool_call",
      "status": "pending",
      "priority": "P2",
      "batch_id": null,
      "last_batch_id": null,
      "run_count": 0,
      "retry_count": 0,
      "max_retry": 2,
      "last_run_at": null,
      "last_duration_ms": null,
      "last_exit_code": null,
      "error_type": null,
      "error_message": null,
      "ignored_reason": null,
      "fix_applied": false,
      "fix_details": null,
      "log_file": null,
      "errors": [],
      "failures": []
    },
    {
      "id": 1864,
      "test_node": "tests/entrypoints/openai/tool_parsers/test_hermes_tool_parser.py::test_non_streaming_product_tool_call",
      "test_file": "tests/entrypoints/openai/tool_parsers/test_hermes_tool_parser.py",
      "test_name": "test_non_streaming_product_tool_call",
      "status": "pending",
      "priority": "P2",
      "batch_id": null,
      "last_batch_id": null,
      "run_count": 0,
      "retry_count": 0,
      "max_retry": 2,
      "last_run_at": null,
      "last_duration_ms": null,
      "last_exit_code": null,
      "error_type": null,
      "error_message": null,
      "ignored_reason": null,
      "fix_applied": false,
      "fix_details": null,
      "log_file": null,
      "errors": [],
      "failures": []
    },
    {
      "id": 1865,
      "test_node": "tests/entrypoints/openai/tool_parsers/test_hermes_tool_parser.py::test_streaming_product_tool_call",
      "test_file": "tests/entrypoints/openai/tool_parsers/test_hermes_tool_parser.py",
      "test_name": "test_streaming_product_tool_call",
      "status": "pending",
      "priority": "P2",
      "batch_id": null,
      "last_batch_id": null,
      "run_count": 0,
      "retry_count": 0,
      "max_retry": 2,
      "last_run_at": null,
      "last_duration_ms": null,
      "last_exit_code": null,
      "error_type": null,
      "error_message": null,
      "ignored_reason": null,
      "fix_applied": false,
      "fix_details": null,
      "log_file": null,
      "errors": [],
      "failures": []
    },
    {
      "id": 1866,
      "test_node": "tests/entrypoints/openai/tool_parsers/test_hermes_tool_parser.py::test_hermes_parser_streaming_just_forward_text",
      "test_file": "tests/entrypoints/openai/tool_parsers/test_hermes_tool_parser.py",
      "test_name": "test_hermes_parser_streaming_just_forward_text",
      "status": "pending",
      "priority": "P2",
      "batch_id": null,
      "last_batch_id": null,
      "run_count": 0,
      "retry_count": 0,
      "max_retry": 2,
      "last_run_at": null,
      "last_duration_ms": null,
      "last_exit_code": null,
      "error_type": null,
      "error_message": null,
      "ignored_reason": null,
      "fix_applied": false,
      "fix_details": null,
      "log_file": null,
      "errors": [],
      "failures": []
    },
    {
      "id": 1867,
      "test_node": "tests/entrypoints/openai/tool_parsers/test_hermes_tool_parser.py::test_hermes_parser_streaming_failure_case_bug_19056",
      "test_file": "tests/entrypoints/openai/tool_parsers/test_hermes_tool_parser.py",
      "test_name": "test_hermes_parser_streaming_failure_case_bug_19056",
      "status": "pending",
      "priority": "P2",
      "batch_id": null,
      "last_batch_id": null,
      "run_count": 0,
      "retry_count": 0,
      "max_retry": 2,
      "last_run_at": null,
      "last_duration_ms": null,
      "last_exit_code": null,
      "error_type": null,
      "error_message": null,
      "ignored_reason": null,
      "fix_applied": false,
      "fix_details": null,
      "log_file": null,
      "errors": [],
      "failures": []
    }
  ],
  "distributed_count": 400,
  "requires_multi_gpu": true,
  "generated_at": "2026-07-02T03:03:41.513614",
  "distributed_tests": [
    {
      "test_node": "tests/compile/distributed/test_async_tp.py::test_async_tp_pass_replace[True-dtype0-16-16-8-TestMMRSModel]",
      "id": 110
    },
    {
      "test_node": "tests/compile/distributed/test_async_tp.py::test_async_tp_pass_replace[True-dtype0-16-16-8-TestAGMMModel]",
      "id": 111
    },
    {
      "test_node": "tests/compile/distributed/test_async_tp.py::test_async_tp_pass_replace[True-dtype1-16-16-8-TestMMRSModel]",
      "id": 116
    },
    {
      "test_node": "tests/compile/distributed/test_async_tp.py::test_async_tp_pass_replace[True-dtype1-16-16-8-TestAGMMModel]",
      "id": 117
    },
    {
      "test_node": "tests/compile/distributed/test_async_tp.py::test_async_tp_pass_replace[True-dtype1-16-16-8-TestScaledMMRSModel]",
      "id": 118
    },
    {
      "test_node": "tests/compile/distributed/test_async_tp.py::test_async_tp_pass_replace[True-dtype1-16-16-8-TestAGScaledMMModel]",
      "id": 119
    },
    {
      "test_node": "tests/compile/distributed/test_async_tp.py::test_async_tp_pass_replace[True-dtype1-16-16-8-TestCutlassScaledMMRSModel]",
      "id": 120
    },
    {
      "test_node": "tests/compile/distributed/test_async_tp.py::test_async_tp_pass_replace[True-dtype1-16-16-8-TestAGCutlassScaledMMModel]",
      "id": 121
    },
    {
      "test_node": "tests/compile/distributed/test_async_tp.py::test_async_tp_pass_replace[False-dtype0-16-16-8-TestMMRSModel]",
      "id": 122
    },
    {
      "test_node": "tests/compile/distributed/test_async_tp.py::test_async_tp_pass_replace[False-dtype0-16-16-8-TestAGMMModel]",
      "id": 123
    }
  ],
  "note": "distributed tests require GPU >= 2"
}