{
  "batch_id": "batch_20260702_023735",
  "tests": [
    {
      "id": 1836,
      "test_node": "tests/entrypoints/openai/test_vision.py::test_single_chat_session_image_base64encoded_beamsearch[1-microsoft/Phi-3.5-vision-instruct]",
      "test_file": "tests/entrypoints/openai/test_vision.py",
      "test_name": "test_single_chat_session_image_base64encoded_beamsearch[1-microsoft/Phi-3.5-vision-instruct]",
      "status": "pending",
      "priority": "P2",
      "batch_id": null,
      "last_batch_id": null,
      "run_count": 0,
      "retry_count": 0,
      "max_retry": 2,
      "last_run_at": null,
      "last_duration_ms": null,
      "last_exit_code": null,
      "error_type": null,
      "error_message": null,
      "ignored_reason": null,
      "fix_applied": false,
      "fix_details": null,
      "log_file": null,
      "errors": [],
      "failures": []
    },
    {
      "id": 1837,
      "test_node": "tests/entrypoints/openai/test_vision.py::test_single_chat_session_image_base64encoded_beamsearch[2-microsoft/Phi-3.5-vision-instruct]",
      "test_file": "tests/entrypoints/openai/test_vision.py",
      "test_name": "test_single_chat_session_image_base64encoded_beamsearch[2-microsoft/Phi-3.5-vision-instruct]",
      "status": "pending",
      "priority": "P2",
      "batch_id": null,
      "last_batch_id": null,
      "run_count": 0,
      "retry_count": 0,
      "max_retry": 2,
      "last_run_at": null,
      "last_duration_ms": null,
      "last_exit_code": null,
      "error_type": null,
      "error_message": null,
      "ignored_reason": null,
      "fix_applied": false,
      "fix_details": null,
      "log_file": null,
      "errors": [],
      "failures": []
    },
    {
      "id": 1838,
      "test_node": "tests/entrypoints/openai/test_vision.py::test_single_chat_session_image_base64encoded_beamsearch[3-microsoft/Phi-3.5-vision-instruct]",
      "test_file": "tests/entrypoints/openai/test_vision.py",
      "test_name": "test_single_chat_session_image_base64encoded_beamsearch[3-microsoft/Phi-3.5-vision-instruct]",
      "status": "pending",
      "priority": "P2",
      "batch_id": null,
      "last_batch_id": null,
      "run_count": 0,
      "retry_count": 0,
      "max_retry": 2,
      "last_run_at": null,
      "last_duration_ms": null,
      "last_exit_code": null,
      "error_type": null,
      "error_message": null,
      "ignored_reason": null,
      "fix_applied": false,
      "fix_details": null,
      "log_file": null,
      "errors": [],
      "failures": []
    },
    {
      "id": 1839,
      "test_node": "tests/entrypoints/openai/test_vision.py::test_chat_streaming_image[2560px-Gfp-wisconsin-madison-the-nature-boardwalk.jpg-microsoft/Phi-3.5-vision-instruct]",
      "test_file": "tests/entrypoints/openai/test_vision.py",
      "test_name": "test_chat_streaming_image[2560px-Gfp-wisconsin-madison-the-nature-boardwalk.jpg-microsoft/Phi-3.5-vision-instruct]",
      "status": "pending",
      "priority": "P2",
      "batch_id": null,
      "last_batch_id": null,
      "run_count": 0,
      "retry_count": 0,
      "max_retry": 2,
      "last_run_at": null,
      "last_duration_ms": null,
      "last_exit_code": null,
      "error_type": null,
      "error_message": null,
      "ignored_reason": null,
      "fix_applied": false,
      "fix_details": null,
      "log_file": null,
      "errors": [],
      "failures": []
    },
    {
      "id": 1840,
      "test_node": "tests/entrypoints/openai/test_vision.py::test_chat_streaming_image[Grayscale_8bits_palette_sample_image.png-microsoft/Phi-3.5-vision-instruct]",
      "test_file": "tests/entrypoints/openai/test_vision.py",
      "test_name": "test_chat_streaming_image[Grayscale_8bits_palette_sample_image.png-microsoft/Phi-3.5-vision-instruct]",
      "status": "pending",
      "priority": "P2",
      "batch_id": null,
      "last_batch_id": null,
      "run_count": 0,
      "retry_count": 0,
      "max_retry": 2,
      "last_run_at": null,
      "last_duration_ms": null,
      "last_exit_code": null,
      "error_type": null,
      "error_message": null,
      "ignored_reason": null,
      "fix_applied": false,
      "fix_details": null,
      "log_file": null,
      "errors": [],
      "failures": []
    },
    {
      "id": 1841,
      "test_node": "tests/entrypoints/openai/test_vision.py::test_chat_streaming_image[1280px-Venn_diagram_rgb.svg.png-microsoft/Phi-3.5-vision-instruct]",
      "test_file": "tests/entrypoints/openai/test_vision.py",
      "test_name": "test_chat_streaming_image[1280px-Venn_diagram_rgb.svg.png-microsoft/Phi-3.5-vision-instruct]",
      "status": "pending",
      "priority": "P2",
      "batch_id": null,
      "last_batch_id": null,
      "run_count": 0,
      "retry_count": 0,
      "max_retry": 2,
      "last_run_at": null,
      "last_duration_ms": null,
      "last_exit_code": null,
      "error_type": null,
      "error_message": null,
      "ignored_reason": null,
      "fix_applied": false,
      "fix_details": null,
      "log_file": null,
      "errors": [],
      "failures": []
    },
    {
      "id": 1842,
      "test_node": "tests/entrypoints/openai/test_vision.py::test_chat_streaming_image[RGBA_comp.png-microsoft/Phi-3.5-vision-instruct]",
      "test_file": "tests/entrypoints/openai/test_vision.py",
      "test_name": "test_chat_streaming_image[RGBA_comp.png-microsoft/Phi-3.5-vision-instruct]",
      "status": "pending",
      "priority": "P2",
      "batch_id": null,
      "last_batch_id": null,
      "run_count": 0,
      "retry_count": 0,
      "max_retry": 2,
      "last_run_at": null,
      "last_duration_ms": null,
      "last_exit_code": null,
      "error_type": null,
      "error_message": null,
      "ignored_reason": null,
      "fix_applied": false,
      "fix_details": null,
      "log_file": null,
      "errors": [],
      "failures": []
    },
    {
      "id": 1843,
      "test_node": "tests/entrypoints/openai/test_vision.py::test_multi_image_input[image_urls0-microsoft/Phi-3.5-vision-instruct]",
      "test_file": "tests/entrypoints/openai/test_vision.py",
      "test_name": "test_multi_image_input[image_urls0-microsoft/Phi-3.5-vision-instruct]",
      "status": "pending",
      "priority": "P2",
      "batch_id": null,
      "last_batch_id": null,
      "run_count": 0,
      "retry_count": 0,
      "max_retry": 2,
      "last_run_at": null,
      "last_duration_ms": null,
      "last_exit_code": null,
      "error_type": null,
      "error_message": null,
      "ignored_reason": null,
      "fix_applied": false,
      "fix_details": null,
      "log_file": null,
      "errors": [],
      "failures": []
    }
  ],
  "distributed_count": 400,
  "requires_multi_gpu": true,
  "generated_at": "2026-07-02T02:37:35.334561",
  "distributed_tests": [
    {
      "test_node": "tests/compile/distributed/test_async_tp.py::test_async_tp_pass_replace[True-dtype0-16-16-8-TestMMRSModel]",
      "id": 110
    },
    {
      "test_node": "tests/compile/distributed/test_async_tp.py::test_async_tp_pass_replace[True-dtype0-16-16-8-TestAGMMModel]",
      "id": 111
    },
    {
      "test_node": "tests/compile/distributed/test_async_tp.py::test_async_tp_pass_replace[True-dtype1-16-16-8-TestMMRSModel]",
      "id": 116
    },
    {
      "test_node": "tests/compile/distributed/test_async_tp.py::test_async_tp_pass_replace[True-dtype1-16-16-8-TestAGMMModel]",
      "id": 117
    },
    {
      "test_node": "tests/compile/distributed/test_async_tp.py::test_async_tp_pass_replace[True-dtype1-16-16-8-TestScaledMMRSModel]",
      "id": 118
    },
    {
      "test_node": "tests/compile/distributed/test_async_tp.py::test_async_tp_pass_replace[True-dtype1-16-16-8-TestAGScaledMMModel]",
      "id": 119
    },
    {
      "test_node": "tests/compile/distributed/test_async_tp.py::test_async_tp_pass_replace[True-dtype1-16-16-8-TestCutlassScaledMMRSModel]",
      "id": 120
    },
    {
      "test_node": "tests/compile/distributed/test_async_tp.py::test_async_tp_pass_replace[True-dtype1-16-16-8-TestAGCutlassScaledMMModel]",
      "id": 121
    },
    {
      "test_node": "tests/compile/distributed/test_async_tp.py::test_async_tp_pass_replace[False-dtype0-16-16-8-TestMMRSModel]",
      "id": 122
    },
    {
      "test_node": "tests/compile/distributed/test_async_tp.py::test_async_tp_pass_replace[False-dtype0-16-16-8-TestAGMMModel]",
      "id": 123
    }
  ],
  "note": "distributed tests require GPU >= 2"
}