{
  "batch_id": "batch_20260704_234642",
  "tests": [
    {
      "id": 2675,
      "test_node": "tests/kernels/attention/test_cache.py::test_reshape_and_cache[auto-cuda:0-0-dtype0-10000-8-64-8-42]",
      "test_file": "tests/kernels/attention/test_cache.py",
      "test_name": "test_reshape_and_cache[auto-cuda:0-0-dtype0-10000-8-64-8-42]",
      "status": "pending",
      "priority": "P2",
      "batch_id": null,
      "last_batch_id": null,
      "run_count": 0,
      "retry_count": 0,
      "max_retry": 2,
      "last_run_at": null,
      "last_duration_ms": null,
      "last_exit_code": null,
      "error_type": null,
      "error_message": null,
      "ignored_reason": null,
      "fix_applied": false,
      "fix_details": null,
      "log_file": null,
      "errors": [],
      "failures": []
    },
    {
      "id": 2677,
      "test_node": "tests/kernels/attention/test_cache.py::test_reshape_and_cache[auto-cuda:0-0-dtype0-10000-8-256-8-42]",
      "test_file": "tests/kernels/attention/test_cache.py",
      "test_name": "test_reshape_and_cache[auto-cuda:0-0-dtype0-10000-8-256-8-42]",
      "status": "pending",
      "priority": "P2",
      "batch_id": null,
      "last_batch_id": null,
      "run_count": 0,
      "retry_count": 0,
      "max_retry": 2,
      "last_run_at": null,
      "last_duration_ms": null,
      "last_exit_code": null,
      "error_type": null,
      "error_message": null,
      "ignored_reason": null,
      "fix_applied": false,
      "fix_details": null,
      "log_file": null,
      "errors": [],
      "failures": []
    },
    {
      "id": 2678,
      "test_node": "tests/kernels/attention/test_cache.py::test_reshape_and_cache[auto-cuda:0-0-dtype0-10000-16-64-8-42]",
      "test_file": "tests/kernels/attention/test_cache.py",
      "test_name": "test_reshape_and_cache[auto-cuda:0-0-dtype0-10000-16-64-8-42]",
      "status": "pending",
      "priority": "P2",
      "batch_id": null,
      "last_batch_id": null,
      "run_count": 0,
      "retry_count": 0,
      "max_retry": 2,
      "last_run_at": null,
      "last_duration_ms": null,
      "last_exit_code": null,
      "error_type": null,
      "error_message": null,
      "ignored_reason": null,
      "fix_applied": false,
      "fix_details": null,
      "log_file": null,
      "errors": [],
      "failures": []
    },
    {
      "id": 2679,
      "test_node": "tests/kernels/attention/test_cache.py::test_reshape_and_cache[auto-cuda:0-0-dtype0-10000-16-80-8-42]",
      "test_file": "tests/kernels/attention/test_cache.py",
      "test_name": "test_reshape_and_cache[auto-cuda:0-0-dtype0-10000-16-80-8-42]",
      "status": "pending",
      "priority": "P2",
      "batch_id": null,
      "last_batch_id": null,
      "run_count": 0,
      "retry_count": 0,
      "max_retry": 2,
      "last_run_at": null,
      "last_duration_ms": null,
      "last_exit_code": null,
      "error_type": null,
      "error_message": null,
      "ignored_reason": null,
      "fix_applied": false,
      "fix_details": null,
      "log_file": null,
      "errors": [],
      "failures": []
    },
    {
      "id": 2680,
      "test_node": "tests/kernels/attention/test_cache.py::test_reshape_and_cache[auto-cuda:0-0-dtype0-10000-16-256-8-42]",
      "test_file": "tests/kernels/attention/test_cache.py",
      "test_name": "test_reshape_and_cache[auto-cuda:0-0-dtype0-10000-16-256-8-42]",
      "status": "pending",
      "priority": "P2",
      "batch_id": null,
      "last_batch_id": null,
      "run_count": 0,
      "retry_count": 0,
      "max_retry": 2,
      "last_run_at": null,
      "last_duration_ms": null,
      "last_exit_code": null,
      "error_type": null,
      "error_message": null,
      "ignored_reason": null,
      "fix_applied": false,
      "fix_details": null,
      "log_file": null,
      "errors": [],
      "failures": []
    },
    {
      "id": 2681,
      "test_node": "tests/kernels/attention/test_cache.py::test_reshape_and_cache[auto-cuda:0-0-dtype0-10000-32-64-8-42]",
      "test_file": "tests/kernels/attention/test_cache.py",
      "test_name": "test_reshape_and_cache[auto-cuda:0-0-dtype0-10000-32-64-8-42]",
      "status": "pending",
      "priority": "P2",
      "batch_id": null,
      "last_batch_id": null,
      "run_count": 0,
      "retry_count": 0,
      "max_retry": 2,
      "last_run_at": null,
      "last_duration_ms": null,
      "last_exit_code": null,
      "error_type": null,
      "error_message": null,
      "ignored_reason": null,
      "fix_applied": false,
      "fix_details": null,
      "log_file": null,
      "errors": [],
      "failures": []
    },
    {
      "id": 2682,
      "test_node": "tests/kernels/attention/test_cache.py::test_reshape_and_cache[auto-cuda:0-0-dtype0-10000-32-80-8-42]",
      "test_file": "tests/kernels/attention/test_cache.py",
      "test_name": "test_reshape_and_cache[auto-cuda:0-0-dtype0-10000-32-80-8-42]",
      "status": "pending",
      "priority": "P2",
      "batch_id": null,
      "last_batch_id": null,
      "run_count": 0,
      "retry_count": 0,
      "max_retry": 2,
      "last_run_at": null,
      "last_duration_ms": null,
      "last_exit_code": null,
      "error_type": null,
      "error_message": null,
      "ignored_reason": null,
      "fix_applied": false,
      "fix_details": null,
      "log_file": null,
      "errors": [],
      "failures": []
    },
    {
      "id": 2683,
      "test_node": "tests/kernels/attention/test_cache.py::test_reshape_and_cache[auto-cuda:0-0-dtype0-10000-32-256-8-42]",
      "test_file": "tests/kernels/attention/test_cache.py",
      "test_name": "test_reshape_and_cache[auto-cuda:0-0-dtype0-10000-32-256-8-42]",
      "status": "pending",
      "priority": "P2",
      "batch_id": null,
      "last_batch_id": null,
      "run_count": 0,
      "retry_count": 0,
      "max_retry": 2,
      "last_run_at": null,
      "last_duration_ms": null,
      "last_exit_code": null,
      "error_type": null,
      "error_message": null,
      "ignored_reason": null,
      "fix_applied": false,
      "fix_details": null,
      "log_file": null,
      "errors": [],
      "failures": []
    }
  ],
  "distributed_count": 400,
  "requires_multi_gpu": true,
  "generated_at": "2026-07-04T23:46:42.010817",
  "distributed_tests": [
    {
      "test_node": "tests/compile/distributed/test_async_tp.py::test_async_tp_pass_replace[True-dtype0-16-16-8-TestMMRSModel]",
      "id": 110
    },
    {
      "test_node": "tests/compile/distributed/test_async_tp.py::test_async_tp_pass_replace[True-dtype0-16-16-8-TestAGMMModel]",
      "id": 111
    },
    {
      "test_node": "tests/compile/distributed/test_async_tp.py::test_async_tp_pass_replace[True-dtype1-16-16-8-TestMMRSModel]",
      "id": 116
    },
    {
      "test_node": "tests/compile/distributed/test_async_tp.py::test_async_tp_pass_replace[True-dtype1-16-16-8-TestAGMMModel]",
      "id": 117
    },
    {
      "test_node": "tests/compile/distributed/test_async_tp.py::test_async_tp_pass_replace[True-dtype1-16-16-8-TestScaledMMRSModel]",
      "id": 118
    },
    {
      "test_node": "tests/compile/distributed/test_async_tp.py::test_async_tp_pass_replace[True-dtype1-16-16-8-TestAGScaledMMModel]",
      "id": 119
    },
    {
      "test_node": "tests/compile/distributed/test_async_tp.py::test_async_tp_pass_replace[True-dtype1-16-16-8-TestCutlassScaledMMRSModel]",
      "id": 120
    },
    {
      "test_node": "tests/compile/distributed/test_async_tp.py::test_async_tp_pass_replace[True-dtype1-16-16-8-TestAGCutlassScaledMMModel]",
      "id": 121
    },
    {
      "test_node": "tests/compile/distributed/test_async_tp.py::test_async_tp_pass_replace[False-dtype0-16-16-8-TestMMRSModel]",
      "id": 122
    },
    {
      "test_node": "tests/compile/distributed/test_async_tp.py::test_async_tp_pass_replace[False-dtype0-16-16-8-TestAGMMModel]",
      "id": 123
    }
  ],
  "note": "distributed tests require GPU >= 2"
}