{
  "batch_id": "batch_20260701_115222",
  "tests": [
    {
      "id": 1532,
      "test_node": "tests/entrypoints/openai/test_lora_adapters.py::test_static_lora_lineage[True]",
      "test_file": "tests/entrypoints/openai/test_lora_adapters.py",
      "test_name": "test_static_lora_lineage[True]",
      "status": "pending",
      "priority": "P2",
      "batch_id": null,
      "last_batch_id": null,
      "run_count": 0,
      "retry_count": 0,
      "max_retry": 2,
      "last_run_at": null,
      "last_duration_ms": null,
      "last_exit_code": null,
      "error_type": null,
      "error_message": null,
      "ignored_reason": null,
      "fix_applied": false,
      "fix_details": null,
      "log_file": null,
      "errors": [],
      "failures": []
    },
    {
      "id": 1533,
      "test_node": "tests/entrypoints/openai/test_lora_adapters.py::test_dynamic_lora_lineage[True]",
      "test_file": "tests/entrypoints/openai/test_lora_adapters.py",
      "test_name": "test_dynamic_lora_lineage[True]",
      "status": "pending",
      "priority": "P2",
      "batch_id": null,
      "last_batch_id": null,
      "run_count": 0,
      "retry_count": 0,
      "max_retry": 2,
      "last_run_at": null,
      "last_duration_ms": null,
      "last_exit_code": null,
      "error_type": null,
      "error_message": null,
      "ignored_reason": null,
      "fix_applied": false,
      "fix_details": null,
      "log_file": null,
      "errors": [],
      "failures": []
    },
    {
      "id": 1534,
      "test_node": "tests/entrypoints/openai/test_lora_adapters.py::test_dynamic_lora_not_found[True]",
      "test_file": "tests/entrypoints/openai/test_lora_adapters.py",
      "test_name": "test_dynamic_lora_not_found[True]",
      "status": "pending",
      "priority": "P2",
      "batch_id": null,
      "last_batch_id": null,
      "run_count": 0,
      "retry_count": 0,
      "max_retry": 2,
      "last_run_at": null,
      "last_duration_ms": null,
      "last_exit_code": null,
      "error_type": null,
      "error_message": null,
      "ignored_reason": null,
      "fix_applied": false,
      "fix_details": null,
      "log_file": null,
      "errors": [],
      "failures": []
    },
    {
      "id": 1535,
      "test_node": "tests/entrypoints/openai/test_lora_adapters.py::test_dynamic_lora_invalid_files[True]",
      "test_file": "tests/entrypoints/openai/test_lora_adapters.py",
      "test_name": "test_dynamic_lora_invalid_files[True]",
      "status": "pending",
      "priority": "P2",
      "batch_id": null,
      "last_batch_id": null,
      "run_count": 0,
      "retry_count": 0,
      "max_retry": 2,
      "last_run_at": null,
      "last_duration_ms": null,
      "last_exit_code": null,
      "error_type": null,
      "error_message": null,
      "ignored_reason": null,
      "fix_applied": false,
      "fix_details": null,
      "log_file": null,
      "errors": [],
      "failures": []
    },
    {
      "id": 1536,
      "test_node": "tests/entrypoints/openai/test_lora_adapters.py::test_dynamic_lora_badrequests[True-test_rank-config_change0-is greater than max_lora_rank]",
      "test_file": "tests/entrypoints/openai/test_lora_adapters.py",
      "test_name": "test_dynamic_lora_badrequests[True-test_rank-config_change0-is greater than max_lora_rank]",
      "status": "pending",
      "priority": "P2",
      "batch_id": null,
      "last_batch_id": null,
      "run_count": 0,
      "retry_count": 0,
      "max_retry": 2,
      "last_run_at": null,
      "last_duration_ms": null,
      "last_exit_code": null,
      "error_type": null,
      "error_message": null,
      "ignored_reason": null,
      "fix_applied": false,
      "fix_details": null,
      "log_file": null,
      "errors": [],
      "failures": []
    },
    {
      "id": 1537,
      "test_node": "tests/entrypoints/openai/test_lora_adapters.py::test_dynamic_lora_badrequests[True-test_dora-config_change1-does not yet support DoRA]",
      "test_file": "tests/entrypoints/openai/test_lora_adapters.py",
      "test_name": "test_dynamic_lora_badrequests[True-test_dora-config_change1-does not yet support DoRA]",
      "status": "pending",
      "priority": "P2",
      "batch_id": null,
      "last_batch_id": null,
      "run_count": 0,
      "retry_count": 0,
      "max_retry": 2,
      "last_run_at": null,
      "last_duration_ms": null,
      "last_exit_code": null,
      "error_type": null,
      "error_message": null,
      "ignored_reason": null,
      "fix_applied": false,
      "fix_details": null,
      "log_file": null,
      "errors": [],
      "failures": []
    },
    {
      "id": 1538,
      "test_node": "tests/entrypoints/openai/test_lora_adapters.py::test_dynamic_lora_badrequests[True-test_modules_to_save-config_change2-only supports modules_to_save being None]",
      "test_file": "tests/entrypoints/openai/test_lora_adapters.py",
      "test_name": "test_dynamic_lora_badrequests[True-test_modules_to_save-config_change2-only supports modules_to_save being None]",
      "status": "pending",
      "priority": "P2",
      "batch_id": null,
      "last_batch_id": null,
      "run_count": 0,
      "retry_count": 0,
      "max_retry": 2,
      "last_run_at": null,
      "last_duration_ms": null,
      "last_exit_code": null,
      "error_type": null,
      "error_message": null,
      "ignored_reason": null,
      "fix_applied": false,
      "fix_details": null,
      "log_file": null,
      "errors": [],
      "failures": []
    },
    {
      "id": 1539,
      "test_node": "tests/entrypoints/openai/test_lora_adapters.py::test_multiple_lora_adapters[True]",
      "test_file": "tests/entrypoints/openai/test_lora_adapters.py",
      "test_name": "test_multiple_lora_adapters[True]",
      "status": "pending",
      "priority": "P2",
      "batch_id": null,
      "last_batch_id": null,
      "run_count": 0,
      "retry_count": 0,
      "max_retry": 2,
      "last_run_at": null,
      "last_duration_ms": null,
      "last_exit_code": null,
      "error_type": null,
      "error_message": null,
      "ignored_reason": null,
      "fix_applied": false,
      "fix_details": null,
      "log_file": null,
      "errors": [],
      "failures": []
    }
  ],
  "distributed_count": 400,
  "requires_multi_gpu": true,
  "generated_at": "2026-07-01T11:52:22.770356",
  "distributed_tests": [
    {
      "test_node": "tests/compile/distributed/test_async_tp.py::test_async_tp_pass_replace[True-dtype0-16-16-8-TestMMRSModel]",
      "id": 110
    },
    {
      "test_node": "tests/compile/distributed/test_async_tp.py::test_async_tp_pass_replace[True-dtype0-16-16-8-TestAGMMModel]",
      "id": 111
    },
    {
      "test_node": "tests/compile/distributed/test_async_tp.py::test_async_tp_pass_replace[True-dtype1-16-16-8-TestMMRSModel]",
      "id": 116
    },
    {
      "test_node": "tests/compile/distributed/test_async_tp.py::test_async_tp_pass_replace[True-dtype1-16-16-8-TestAGMMModel]",
      "id": 117
    },
    {
      "test_node": "tests/compile/distributed/test_async_tp.py::test_async_tp_pass_replace[True-dtype1-16-16-8-TestScaledMMRSModel]",
      "id": 118
    },
    {
      "test_node": "tests/compile/distributed/test_async_tp.py::test_async_tp_pass_replace[True-dtype1-16-16-8-TestAGScaledMMModel]",
      "id": 119
    },
    {
      "test_node": "tests/compile/distributed/test_async_tp.py::test_async_tp_pass_replace[True-dtype1-16-16-8-TestCutlassScaledMMRSModel]",
      "id": 120
    },
    {
      "test_node": "tests/compile/distributed/test_async_tp.py::test_async_tp_pass_replace[True-dtype1-16-16-8-TestAGCutlassScaledMMModel]",
      "id": 121
    },
    {
      "test_node": "tests/compile/distributed/test_async_tp.py::test_async_tp_pass_replace[False-dtype0-16-16-8-TestMMRSModel]",
      "id": 122
    },
    {
      "test_node": "tests/compile/distributed/test_async_tp.py::test_async_tp_pass_replace[False-dtype0-16-16-8-TestAGMMModel]",
      "id": 123
    }
  ],
  "note": "distributed tests require GPU >= 2"
}