{
  "batch_id": "batch_20260701_231606",
  "tests": [
    {
      "id": 1676,
      "test_node": "tests/entrypoints/openai/test_response_api_with_harmony.py::test_function_calling_full_history[openai/gpt-oss-20b]",
      "test_file": "tests/entrypoints/openai/test_response_api_with_harmony.py",
      "test_name": "test_function_calling_full_history[openai/gpt-oss-20b]",
      "status": "pending",
      "priority": "P2",
      "batch_id": null,
      "last_batch_id": null,
      "run_count": 0,
      "retry_count": 0,
      "max_retry": 2,
      "last_run_at": null,
      "last_duration_ms": null,
      "last_exit_code": null,
      "error_type": null,
      "error_message": null,
      "ignored_reason": null,
      "fix_applied": false,
      "fix_details": null,
      "log_file": null,
      "errors": [],
      "failures": []
    },
    {
      "id": 1677,
      "test_node": "tests/entrypoints/openai/test_response_api_with_harmony.py::test_function_calling_with_stream[openai/gpt-oss-20b]",
      "test_file": "tests/entrypoints/openai/test_response_api_with_harmony.py",
      "test_name": "test_function_calling_with_stream[openai/gpt-oss-20b]",
      "status": "pending",
      "priority": "P2",
      "batch_id": null,
      "last_batch_id": null,
      "run_count": 0,
      "retry_count": 0,
      "max_retry": 2,
      "last_run_at": null,
      "last_duration_ms": null,
      "last_exit_code": null,
      "error_type": null,
      "error_message": null,
      "ignored_reason": null,
      "fix_applied": false,
      "fix_details": null,
      "log_file": null,
      "errors": [],
      "failures": []
    },
    {
      "id": 1678,
      "test_node": "tests/entrypoints/openai/test_response_api_with_harmony.py::test_output_messages_enabled[openai/gpt-oss-20b]",
      "test_file": "tests/entrypoints/openai/test_response_api_with_harmony.py",
      "test_name": "test_output_messages_enabled[openai/gpt-oss-20b]",
      "status": "pending",
      "priority": "P2",
      "batch_id": null,
      "last_batch_id": null,
      "run_count": 0,
      "retry_count": 0,
      "max_retry": 2,
      "last_run_at": null,
      "last_duration_ms": null,
      "last_exit_code": null,
      "error_type": null,
      "error_message": null,
      "ignored_reason": null,
      "fix_applied": false,
      "fix_details": null,
      "log_file": null,
      "errors": [],
      "failures": []
    },
    {
      "id": 1679,
      "test_node": "tests/entrypoints/openai/test_response_api_with_harmony.py::test_function_call_with_previous_input_messages[openai/gpt-oss-20b]",
      "test_file": "tests/entrypoints/openai/test_response_api_with_harmony.py",
      "test_name": "test_function_call_with_previous_input_messages[openai/gpt-oss-20b]",
      "status": "pending",
      "priority": "P2",
      "batch_id": null,
      "last_batch_id": null,
      "run_count": 0,
      "retry_count": 0,
      "max_retry": 2,
      "last_run_at": null,
      "last_duration_ms": null,
      "last_exit_code": null,
      "error_type": null,
      "error_message": null,
      "ignored_reason": null,
      "fix_applied": false,
      "fix_details": null,
      "log_file": null,
      "errors": [],
      "failures": []
    },
    {
      "id": 1680,
      "test_node": "tests/entrypoints/openai/test_responses_error.py::test_raise_if_error_raises_generation_error",
      "test_file": "tests/entrypoints/openai/test_responses_error.py",
      "test_name": "test_raise_if_error_raises_generation_error",
      "status": "pending",
      "priority": "P2",
      "batch_id": null,
      "last_batch_id": null,
      "run_count": 0,
      "retry_count": 0,
      "max_retry": 2,
      "last_run_at": null,
      "last_duration_ms": null,
      "last_exit_code": null,
      "error_type": null,
      "error_message": null,
      "ignored_reason": null,
      "fix_applied": false,
      "fix_details": null,
      "log_file": null,
      "errors": [],
      "failures": []
    },
    {
      "id": 1681,
      "test_node": "tests/entrypoints/openai/test_responses_error.py::test_convert_generation_error_to_response",
      "test_file": "tests/entrypoints/openai/test_responses_error.py",
      "test_name": "test_convert_generation_error_to_response",
      "status": "pending",
      "priority": "P2",
      "batch_id": null,
      "last_batch_id": null,
      "run_count": 0,
      "retry_count": 0,
      "max_retry": 2,
      "last_run_at": null,
      "last_duration_ms": null,
      "last_exit_code": null,
      "error_type": null,
      "error_message": null,
      "ignored_reason": null,
      "fix_applied": false,
      "fix_details": null,
      "log_file": null,
      "errors": [],
      "failures": []
    },
    {
      "id": 1682,
      "test_node": "tests/entrypoints/openai/test_responses_error.py::test_convert_generation_error_to_streaming_response",
      "test_file": "tests/entrypoints/openai/test_responses_error.py",
      "test_name": "test_convert_generation_error_to_streaming_response",
      "status": "pending",
      "priority": "P2",
      "batch_id": null,
      "last_batch_id": null,
      "run_count": 0,
      "retry_count": 0,
      "max_retry": 2,
      "last_run_at": null,
      "last_duration_ms": null,
      "last_exit_code": null,
      "error_type": null,
      "error_message": null,
      "ignored_reason": null,
      "fix_applied": false,
      "fix_details": null,
      "log_file": null,
      "errors": [],
      "failures": []
    },
    {
      "id": 1683,
      "test_node": "tests/entrypoints/openai/test_responses_function_call_parsing.py::test_function_call_dict_converted_to_object",
      "test_file": "tests/entrypoints/openai/test_responses_function_call_parsing.py",
      "test_name": "test_function_call_dict_converted_to_object",
      "status": "pending",
      "priority": "P2",
      "batch_id": null,
      "last_batch_id": null,
      "run_count": 0,
      "retry_count": 0,
      "max_retry": 2,
      "last_run_at": null,
      "last_duration_ms": null,
      "last_exit_code": null,
      "error_type": null,
      "error_message": null,
      "ignored_reason": null,
      "fix_applied": false,
      "fix_details": null,
      "log_file": null,
      "errors": [],
      "failures": []
    }
  ],
  "distributed_count": 400,
  "requires_multi_gpu": true,
  "generated_at": "2026-07-01T23:16:06.140560",
  "distributed_tests": [
    {
      "test_node": "tests/compile/distributed/test_async_tp.py::test_async_tp_pass_replace[True-dtype0-16-16-8-TestMMRSModel]",
      "id": 110
    },
    {
      "test_node": "tests/compile/distributed/test_async_tp.py::test_async_tp_pass_replace[True-dtype0-16-16-8-TestAGMMModel]",
      "id": 111
    },
    {
      "test_node": "tests/compile/distributed/test_async_tp.py::test_async_tp_pass_replace[True-dtype1-16-16-8-TestMMRSModel]",
      "id": 116
    },
    {
      "test_node": "tests/compile/distributed/test_async_tp.py::test_async_tp_pass_replace[True-dtype1-16-16-8-TestAGMMModel]",
      "id": 117
    },
    {
      "test_node": "tests/compile/distributed/test_async_tp.py::test_async_tp_pass_replace[True-dtype1-16-16-8-TestScaledMMRSModel]",
      "id": 118
    },
    {
      "test_node": "tests/compile/distributed/test_async_tp.py::test_async_tp_pass_replace[True-dtype1-16-16-8-TestAGScaledMMModel]",
      "id": 119
    },
    {
      "test_node": "tests/compile/distributed/test_async_tp.py::test_async_tp_pass_replace[True-dtype1-16-16-8-TestCutlassScaledMMRSModel]",
      "id": 120
    },
    {
      "test_node": "tests/compile/distributed/test_async_tp.py::test_async_tp_pass_replace[True-dtype1-16-16-8-TestAGCutlassScaledMMModel]",
      "id": 121
    },
    {
      "test_node": "tests/compile/distributed/test_async_tp.py::test_async_tp_pass_replace[False-dtype0-16-16-8-TestMMRSModel]",
      "id": 122
    },
    {
      "test_node": "tests/compile/distributed/test_async_tp.py::test_async_tp_pass_replace[False-dtype0-16-16-8-TestAGMMModel]",
      "id": 123
    }
  ],
  "note": "distributed tests require GPU >= 2"
}